<?xml version="1.0"?>
<!DOCTYPE actions SYSTEM "action-mapping.dtd">
<actions>
    <action name="clean">
        <args>clean</args>
    </action>

    <action name="build">
        <args>build</args>
    </action>

    <action name="rebuild">
        <args>clean build</args>
    </action>

    <action name="test">
        <args>--rerun-tasks test</args>
    </action>

    <action name="download.javadoc">
        <reload rule="ALWAYS_ONLINE">
            <args>-PdownloadJavadoc={0}</args>
        </reload>
    </action>

    <action name="download.sources">
        <reload rule="ALWAYS_ONLINE">
            <args>-PdownloadSources={0}</args>
        </reload>
    </action>

    <action name="download.sourcesanddoc">
        <reload rule="ALWAYS_ONLINE">
            <args>-PdownloadSources={0} -PdownloadJavadoc={0}</args>
        </reload>
    </action>

    <apply-for plugins="java">
        <action name="test.single">
            <args>--rerun-tasks test -tests {0}</args>
        </action>

        <action name="debug.test.single">
            <args>--rerun-tasks test --debug-jvm --tests {0}</args>
        </action>

        <action name="javadoc">
            <args>javadoc</args>
        </action>

        <action name="debug.fix" repeatable="false">
            <args>-offline --no-rebuild {0}</args>
            <reload rule="NEVER"/>
        </action>
    </apply-for>

    <apply-for plugins="application">
        <action name="run">
            <args>run</args>
        </action>

        <action name="debug">
            <args>run --debug-jvm</args>
        </action>
    </apply-for>

    <apply-for plugins="com.github.lkishalmi.gatling">
        <action name="run">
            <args>gatling</args>
        </action>
    </apply-for>

    <apply-for plugins="root">
        <action name="clean">
            <args>clean</args>
        </action>

        <action name="build">
            <args>assemble</args>
        </action>

        <action name="rebuild">
            <args>clean assemble</args>
        </action>
    </apply-for>

    <apply-for plugins="war">
        <action name="run">
            <args>war</args>
        </action>
    </apply-for>
</actions>

